examples/autotune/kda_gate_fwd_kernel_cache_sm90/CQBKSE4E37HQKRUEDZTZZLXES6MAHA7363HIAIHYB26LE6DEAAKA/kda_gate_fwd_kernel.autotune.json
{"key": [2, 12, "torch.float32", "torch.float32", "torch.float32"], "configs_timings": [[{"kwargs": {"BT": 32}, "num_warps": 4, "num_ctas": 1, "num_stages": 2, "maxnreg": null, "pre_hook": null, "ir_override": null}, [0.004736000206321478, 0.004575999919325113, 0.004863999783992767]], [{"kwargs": {"BT": 32}, "num_warps": 4, "num_ctas": 1, "num_stages": 3, "maxnreg": null, "pre_hook": null, "ir_override": null}, [0.004720000084489584, 0.004575999919325113, 0.004863999783992767]], [{"kwargs": {"BT": 32}, "num_warps": 8, "num_ctas": 1, "num_stages": 2, "maxnreg": null, "pre_hook": null, "ir_override": null}, [0.004736000206321478, 0.004575999919325113, 0.004863999783992767]], [{"kwargs": {"BT": 32}, "num_warps": 8, "num_ctas": 1, "num_stages": 3, "maxnreg": null, "pre_hook": null, "ir_override": null}, [0.00470399996265769, 0.0044479998759925365, 0.004863999783992767]], [{"kwargs": {"BT": 32}, "num_warps": 16, "num_ctas": 1, "num_stages": 2, "maxnreg": null, "pre_hook": null, "ir_override": null}, [0.004800000227987766, 0.004544000141322613, 0.004896000027656555]], [{"kwargs": {"BT": 32}, "num_warps": 16, "num_ctas": 1, "num_stages": 3, "maxnreg": null, "pre_hook": null, "ir_override": null}, [0.004832000005990267, 0.004480000119656324, 0.004896000027656555]], [{"kwargs": {"BT": 32}, "num_warps": 32, "num_ctas": 1, "num_stages": 2, "maxnreg": null, "pre_hook": null, "ir_override": null}, [0.004896000027656555, 0.004608000162988901, 0.00508800009265542]], [{"kwargs": {"BT": 32}, "num_warps": 32, "num_ctas": 1, "num_stages": 3, "maxnreg": null, "pre_hook": null, "ir_override": null}, [0.004896000027656555, 0.004863999783992767, 0.0050559998489916325]], [{"kwargs": {"BT": 64}, "num_warps": 4, "num_ctas": 1, "num_stages": 2, "maxnreg": null, "pre_hook": null, "ir_override": null}, [0.004863999783992767, 0.004608000162988901, 0.005024000070989132]], [{"kwargs": {"BT": 64}, "num_warps": 4, "num_ctas": 1, "num_stages": 3, "maxnreg": null, "pre_hook": null, "ir_override": null}, [0.004863999783992767, 0.004736000206321478, 0.004991999827325344]], [{"kwargs": {"BT": 64}, "num_warps": 8, "num_ctas": 1, "num_stages": 2, "maxnreg": null, "pre_hook": null, "ir_override": null}, [0.004767999984323978, 0.004480000119656324, 0.004896000027656555]], [{"kwargs": {"BT": 64}, "num_warps": 8, "num_ctas": 1, "num_stages": 3, "maxnreg": null, "pre_hook": null, "ir_override": null}, [0.004736000206321478, 0.00470399996265769, 0.004896000027656555]], [{"kwargs": {"BT": 64}, "num_warps": 16, "num_ctas": 1, "num_stages": 2, "maxnreg": null, "pre_hook": null, "ir_override": null}, [0.004767999984323978, 0.00470399996265769, 0.004896000027656555]], [{"kwargs": {"BT": 64}, "num_warps": 16, "num_ctas": 1, "num_stages": 3, "maxnreg": null, "pre_hook": null, "ir_override": null}, [0.004832000005990267, 0.004544000141322613, 0.004896000027656555]], [{"kwargs": {"BT": 64}, "num_warps": 32, "num_ctas": 1, "num_stages": 2, "maxnreg": null, "pre_hook": null, "ir_override": null}, [0.004896000027656555, 0.004863999783992767, 0.005024000070989132]], [{"kwargs": {"BT": 64}, "num_warps": 32, "num_ctas": 1, "num_stages": 3, "maxnreg": null, "pre_hook": null, "ir_override": null}, [0.004896000027656555, 0.004863999783992767, 0.0050559998489916325]], [{"kwargs": {"BT": 128}, "num_warps": 4, "num_ctas": 1, "num_stages": 2, "maxnreg": null, "pre_hook": null, "ir_override": null}, [0.005183999892324209, 0.00508800009265542, 0.005280000157654285]], [{"kwargs": {"BT": 128}, "num_warps": 4, "num_ctas": 1, "num_stages": 3, "maxnreg": null, "pre_hook": null, "ir_override": null}, [0.005216000135987997, 0.00508800009265542, 0.005280000157654285]], [{"kwargs": {"BT": 128}, "num_warps": 8, "num_ctas": 1, "num_stages": 2, "maxnreg": null, "pre_hook": null, "ir_override": null}, [0.004863999783992767, 0.004608000162988901, 0.0050559998489916325]], [{"kwargs": {"BT": 128}, "num_warps": 8, "num_ctas": 1, "num_stages": 3, "maxnreg": null, "pre_hook": null, "ir_override": null}, [0.004863999783992767, 0.004639999940991402, 0.0050559998489916325]], [{"kwargs": {"BT": 128}, "num_warps": 16, "num_ctas": 1, "num_stages": 2, "maxnreg": null, "pre_hook": null, "ir_override": null}, [0.004863999783992767, 0.004608000162988901, 0.0050559998489916325]], [{"kwargs": {"BT": 128}, "num_warps": 16, "num_ctas": 1, "num_stages": 3, "maxnreg": null, "pre_hook": null, "ir_override": null}, [0.004863999783992767, 0.004608000162988901, 0.0050559998489916325]], [{"kwargs": {"BT": 128}, "num_warps": 32, "num_ctas": 1, "num_stages": 2, "maxnreg": null, "pre_hook": null, "ir_override": null}, [0.0049600000493228436, 0.004639999940991402, 0.005119999870657921]], [{"kwargs": {"BT": 128}, "num_warps": 32, "num_ctas": 1, "num_stages": 3, "maxnreg": null, "pre_hook": null, "ir_override": null}, [0.004927999805659056, 0.004863999783992767, 0.0050559998489916325]]]}